Name,Ingredients,Garnish,Preparation
neko colada,"1 oz miso washed white rhum agricole, 1 oz cocchi vermouth di torino, .75 oz falernum, .75 oz coconut cream, .25 oz luxardo amaretto di saschira, .75 oz lime, .5 oz mandarin orange",pink bendy straw,shake and strain into a tiki cat filled with crushed ice.
opaka raka,"1.5 oz junipero gin, 1.5 oz don's mix*, .75 oz lime juice, .25 oz simple syrup, 1 dash bittermens 'elemakule tiki bitters",lime wheel,"shake and strain into an ice-filled highball glass. garnish with a lime wheel.

*don's mix:
-- 2 parts grapefruit juice
-- 1 part cinnamon syrup"
chingerito,"2 oz barsol primero quebranta pisco, 1.5 oz grape juice, 1 oz barsol perfecto amor (aperitif wine), 1 oz fresh pomegranate juice, .75 oz cinnamon syrup, .75 oz fresh lime juice, 4  grapes",,shake and strain into ice filled glass.
tokyo tea,"1.5 oz nikka coffey grain whisky, 1 oz yogurt liquor, .5 oz milk, .5 oz golden sesame honey, 1 dash angostura bitters, 1 tsp matcha tea",salted pistachio,shake and strain into rocks glass.
knockemdown key,"2 oz english harbour rum, .5 oz briottet creme de banane, .25 oz luxardo maraschino liqueur, .5 oz lime juice, 1 bsp rich simple syrup",lime wheel,shake and strain into small cocktail glass.
andy warhol,"1.5 oz no.3 london dry gin, .5 oz tempus fugit alessio vermouth bianco, 1 oz fresh squeezed ruby grapefruit, .5 oz simple syrup, 3 slices cucumber, 1 fill soda water",basil,"shake and strain over fresh ice into collins glass. add soda. garnish with basil.
"
ginger drop,".5 oz king's ginger liqueur, 1.5 oz momokawa organic junmai ginjo sake, .75 oz lemon juice, .5 oz simple syrup",lemon wheel,shake and strain up into cocktail glass.
pants off dance off,".75 oz barsol perfecto amor (aperitif wine), .5 oz lime juice, 1 oz junipero gin, .5 oz grenadine, 1 dash angostura bitters, 1 drop bittermens burlesque bitters",,shake and top with anchor steam.
gin n' celery,"1.5 oz old tom gin, .75 oz lemon juice, .5 oz small hand foods gum syrup, 7 dash celery bitters, 1 oz tonic water, 1 pinch salt",lemon peel (bitter covered),"shake booze, juice and gum. add bitters and salt to a double rocks glass then add ice. strain cocktail, top with tonic. garnish with bitter covered lemon peel."
“prepare for destiny! where’s my pizza?”,"1 oz green hat spring/summer gin, .25 oz luxardo maraschino liqueur, .5 oz lime, .5 oz sugar rich simple, 1 dash celery bitters, 3 oz fever-tree soda",basil leaf,"shake everything but soda water. strain into a bamboo highball, add soda water, add ice, garnish with a basil leaf."
"eat, drink and be cherry",".75 oz nikka coffey grain whisky, .75 oz luxardo sangue morlacco cherry liqueur, .5 oz mendolera, .5 oz cane sugar, .5 oz lemon, 3 oz fever-tree soda",3 cherries picked,"shake everything except for the soda water, strain into bamboo highball, add soda, add ice, garnish with 3 picked cherries."
bird to buck,"1 1/2 part pink pigeon rum, 1/2 part benedictine, 1/4 part orgeat syrup, 1/2 part lime,  part fee brothers whiskey barrel bitters",,shake fine and strain on crushed ice. top with strong ginger beer.
palermo breeze,"1.5 oz luxardo bitter bianco, .5 oz velvet falernum, .5 oz lime, .5 oz passion fruit syrup, 2 oz belstar sparkling rose","basil flower, lime flower",shake first 4 ingredients and strain into collins. top with pebble ice. top with the rose. garnish with a basil and a lime flower for aromatics.
nola '75,"1.25 oz junipero gin, .5 oz pages elderflower syrup, .5 oz fresh lemon juice,  oz champagne (sparkling wine)",,"shake first three ingredients in an ice-filled cocktail shaker. strain into a chilled serving glass. top with chilled champagne, or sparkling wine."
the last wish,"1 oz luxardo amaro abano, 1 oz luxardo amaretto di saschira, 2 oz espresso coffee, 1 scoop vanilla ice cream",mint sprig,"shake first three ingredients with ice.

strain over ice cream into prepared glass."
aviation (adapted),"2 oz no.3 london dry gin, .5 oz luxardo maraschino liqueur, .5 oz fresh lemon juice, .25 oz tempus fugit liqueur de violettes","lemon peel, luxardo cherry","shake gin, maraschino, and lemon juice with ice then strain into a chilled cocktail glass. use a bar spoon to float the violettes (which it will sink) into the bottom of the glass. garnish with a lemon peel and a luxardo cherry on a pick."
vesper's sister,"1 oz van gogh blue vodka, 1 oz no.3 london dry gin, .5 oz lillet blanc, .25 oz st. germain","lemon twist, orange twist",shake ingredients very well with ice and strain into a martini glass. garnish with lemon and orange twists.
the french connection,"2 oz h by hine, 1 oz fresh lemon juice, 1 oz demarara simple syrup, 4 dash apple bitters","lemon slice, apple slice","shake ingredients with ice in shaker and then double strain into a couple glass.
top with champagne and garnish with lemon and apple slice."
hanky panky (classic),"1.5 oz no.3 london dry gin, 1.5 oz tempus fugit alessio vermouth di torino rosso, 2 dash luxardo fernet",orange peel,shake ingredients with ice then strain into a chilled cocktail glass.
pistachio follies,"1 oz luxardo amaro abano, 1 oz aged rum, 1 oz fresh cream(not whipped), .5 oz pistachio syrup",ground pistachios,shake ingredients with ice then strain into a cocktail glass previously swirled with chocolate syrup and rimmed with ground pistachios.
smoke on the dock,".75 oz luxardo fernet, .34 oz mezcal, 1.5 oz fresh lime sweet n' sour mix, 2 oz pomegranate juice","fresh english mint, pomegranate seeds",shake ingredients with ice then strain into a collins glass.
abano sour,"1.5 oz luxardo amaro abano, 1 oz fresh lemon juice, .25 oz agave nectar, 1 dash grapefruit bitters, .5 oz egg white",cardamom sugar,shake ingredients with ice then strain into a sour cocktail glass previously rimmed with cardamom sugar.
singapore sling (1915 recipe),"1.5 oz no.3 london dry gin, .5 oz luxardo sangue morlacco cherry liqueur, .25 oz luxardo triplum (triple sec), .25 oz luxardo fernet, 3 oz pineapple juice, .5 oz fresh lime juice, 2 dash bitters",fresh pineapple wedge,shake ingredients with ice then strain into an ice-filled collins or pilsner glass.
windtalker,"1.5 oz hirsch small batch reserve bourbon, .75 oz luxardo amaretto di saschira, .5 oz king's ginger liqueur, .75 oz fresh lemon juice, .5 oz egg white","orange peel, luxardo cherries",shake ingredients with ice until well combined. strain into a chilled tumbler or large rocks glass over ice sphere or large ice cubes. garnish with orange peel (or slice) and luxardo original maraschino cherries on a pick.
stinger,"1 part tempus fugit creme de menthe glaciale, 3 part h by hine",,shake or stir briskly and strain into a cocktail glass.
the great pumpkin cocktail,"1 oz pumpkin-infused glenrothes vintage reserve*, 1 oz king's ginger liqueur, .5 oz fresh lemon juice, .5 oz grade-a maple syrup (prefer mcclure's)",cinnamon,"shake over ice and strain into a chilled cocktail coupe. garnish with a dash of cinnamon.

*pumpkin-infused glenrothes vintage reserve:
peel, clean and cut small 2x2 in. pieces of sugar pumpkin. salt very lightly and roast for about 20 mins. at 250°f. put into a sealed container with scotch and let rest for 2 days. strain off the pumpkin and re-bottle. keep refrigerated."
cherry orchard,".5 oz luxardo sangue morlacco cherry liqueur, .25 oz luxardo maraschino liqueur, .5 oz laird's straight bonded , 1.25 oz clear creek kirschwasser eau de vie, .25 oz lemon juice, .5 oz grapefruit juice, .25 oz simple syrup, 2 dash peychaud's bitters",grapefruit peel,shake over ice. strain into a 6 oz. cocktail glass
slow ride,"1 oz rittenhouse straight rye whisky, .5 oz pusser's rum, .5 oz king's ginger liqueur, 2 oz basic house lemonade*,  top abita big easy ipa","lemon wheel, flowers","shake rye, rum, lemonade, and ginger liqueur. strain over fresh ice in a copper mug. top with abita big easy ipa (or similar session ipa). gently stir.

*basic house lemonade:
-- 2 parts water
-- 1 part sugar
-- 1 part lemon juice"
tropical bronzer,"1.5 oz aged rum, 1 oz luxardo amaretto di saschira, 1 oz passion fruit puree, 2 oz fresh lime sweet n' sour, 2 dash bitters, 1 float coconut foam",coconut flakes,shake the first five ingredients with ice then strain over fresh ice into a collins or tiki glass. top with coconut foam.
padova collins,"1.5 oz pear flavored vodka, .75 oz luxardo limoncello, .25 oz luxardo sambuca dei cesari, 1.5 oz fresh sweet n' sour mix, 2 oz lemon lime soda",fresh pear,shake the first four ingredients with ice then strain into a tall glass filled with ice and top with lemon lime soda. stir and serve.
black jam,"1.5 oz luxardo fernet, .75 oz honey syrup, .75 oz fresh lemon juice, 4 oz tonic water",lemon verbena sprig,"shake the first three ingredients with ice then strain into a collins glass and fill up with tonic water, stir and serve."
americana fizz (layered cocktail),"1.5 oz junipero gin, .75 oz fresh lemon juice, .25 oz simple syrup, .75 oz the genuine curacao liqueur blue, .5 oz luxardo aperitivo,  splash perrier grapefruit","luxardo cherries, blueberries","shake the gin, lemon, and simple syrup ingredients together in a shaker to chill. gently pour into a highball glass filled with ice and 3/4 oz curacao blue. top the cocktail with 1/2 oz luxardo aperitivo. add a splash of perrier grapefruit and garnish with luxardo cherries and blueberries for color."
dutch stories,"1.5 oz genevieve gin, .75 oz luxardo apricot liqueur, .25 oz luxardo maraschino liqueur, .5 oz fresh lemon juice, 1 tbsp gooseberry jam",physalis(aka goose berry),"shake the ingredients with ice, then strain into a chilled cocktail glass."
strike no.3,"2 oz no.3 london dry gin, .5 oz st. germaine elderflower liqueur, .5 oz orgeat syrup, .5 oz fresh lemon juice",luxardo cherry,shake the ingredients with ice. strain into an old fashioned glass. garnish with a luxardo cherry.
final ward,".75 oz rye whiskey, .75 oz green chartreuse, .75 oz luxardo maraschino liqueur, .75 oz fresh lemon juice",,shake until very cold; double strain into a chilled cocktail glass. no garnish.
dernier mot,".75 oz rhum agricole, .75 oz green chartreuse, .75 oz luxardo maraschino liqueur, .75 oz fresh lime juice",,shake until very cold; double strain into a chilled cocktail glass. no garnish.
the asterisk,".75 oz brandy, .75 oz green chartreuse, .75 oz luxardo maraschino liqueur, .75 oz lemon juice",,shake until very cold; double strain into a chilled cocktail glass. no garnish.
phineas flip,"2 oz english harbour rum, .75 oz king's ginger liqueur, 1 whole egg",,shake vigorously. strain into highball glass. top with ale. grated nutmeg.
luxardo sling,".25 oz luxardo sangue morlacco cherry liqueur, .5 oz no.3 london dry gin, .25 oz grapefruit juice, 1 fill soda water",,"shake well in a shaker, serve in a tumbler filled with ice. top with soda water."
white lady,"2 oz junipero gin, .5 oz luxardo triplum (triple sec), .5 oz lemon juice, 1  egg white",,"shake well with cracked ice, then strain into a chilled cocktail glass."
blue 88,"1.5 oz no.3 london dry gin, .25 oz lemon juice, .25 oz pages elderflower syrup, .25 oz tempus fugit liqueur de violettes, .25 oz luxardo maraschino liqueur",luxardo cherry,shake well with lots of ice. strain into cocktail glass.
cherries st. james,"1.5 oz no.3 london dry gin, .25 oz lemon juice, .25 oz pages elderflower syrup, .25 oz luxardo sangue morlacco cherry liqueur, .25 oz luxardo maraschino liqueur",luxardo cherry,shake well with lots of ice. strain into cocktail glass.
bachelor's bait,"2 oz junipero gin, 6 dash grapefruit shrub, 3 dash orange bitters, 1 dash grenadine, 1  egg white",,shake with cracked ice and strain into a chilled cocktail glass.
boomin' granny,"1.5 oz h by hine, 1 oz granny smith apple juice, .5 oz fresh lime juice, .5 oz acacia honey syrup,  top sparkling wine",granny smith apple fan,shake with ice and fine strain into a champagne flute. top with sparkling wine and garnish with granny smith apple fan.
basilway daquiri,"1.5 oz basil-infused white rum, .5 oz king's ginger liqueur, .25 oz fresh lime juice, .25 oz luxardo maraschino liqueur, 1 bsp, large grapefruit sorbet",basil leaf,shake with ice and single strain into a coupe glass. garnish with basil leaf.
the pink pussycat,"1.5 oz pink pigeon rum, .5 oz fair goji berry liqueur, .5 oz noyeau de poissy  b, .5 oz cream, 5 dash chocolate bitters",toasted marshmallow,shake with ice and strain into a coupe glass. garnish with a toasted marshmallow
double trouble,"1.5 oz junipero gin, 1 oz strawberry & black pepper shrub*, .75 oz hidalgo la gitana manzanilla sherry, .5 oz lemon juice , few drops peychaud's bitters",mint leaf,"shake with ice and strain into a footed pilsner glass. add a few drops of bitters. garnish with a mint leaf.

*strawberry & black pepper shrub:
-- 1 cup sliced strawberries
-- 1 cup granulated sugar
-- 1 cup champagne vinegar
-- 1 handful of black balinese peppers

combine all ingredients in a medium bowl. using a potato masher or a wooden spoon, mash the berries so they release their juices. stir until the sugar has mostly dissolved and refrigerate overnight.
the next day, remove the mixture to a saucepan and heat gently over medium-low heat. do not bring to a simmer--you simply want to heat the mixture to coax the sugar to dissolve.
strain the shrub through a fine mesh strainer. if desired, strain again through a coffee filter. refrigerate."
yawkey way,"1.5 oz no.3 london dry gin, .5 oz smith & cross, .5 oz strawberry juice, .5 oz black tea syrup, .5 oz lemon juice, 2 dashes orange bitters",,shake with ice and strain into an ice-filled collins glass.
cream of the crop,"1 oz mezcal, 1 oz king's ginger liqueur, .75 oz coconut pistachio puree*, .75 oz lemon juice",candied ginger,"shake with ice in a mixing glass for about 15 seconds to properly chill. double strain into a small fizz glass over ice.

*coconut pistachio puree:
-- .5 lb pistachios (toasted)
-- 1.5 lbs sugar (144 oz.)
-- 11 oz coconut milk
-- 13 oz water
-- 1 tsp salt

toast the pistachios at 250°f for 20 mins. remove and put in a blender with sugar until well chopped. combine all the ingredients in a pot and bring to a boil. let simmer for 20 mins and then remove from the heat. let cool and place in a large container. let the mixture sit overnight then strain out the solids. save the solids to spin in the ice cream maker (if you have one). spin the solids and add the mixture back into the puree via chinois. bottle, label and date the syrup (it will keep indefinitely if you freeze it)."
hemingway daiquiri,"1.5 oz pink pigeon rum, .75 oz fresh lime juice, .5 oz fresh grapefruit juice, .5 oz luxardo maraschino liqueur",grapefruit twist,shake with ice in a mixing tin and double strain into a chilled cocktail coupe. garnish with a grapefruit twist.
amaretto sour (modern),"2 oz luxardo amaretto di saschira, 1 oz fresh squeezed lemon juice, .5 oz pasteurized egg white, 1, small scoop lemon sorbet","luxardo cherries, fresh lemon zest",shake with ice to mix and emulsify. strain into a chilled old fashioned glass filled with ice. garnish with luxardo maraschino cherries and fresh lemon zest.
amaretto sour,"2 oz luxardo amaretto di saschira, 1 oz fresh lemon juice, .75 oz simple syrup, .5 oz egg white","luxardo cherries, fresh lemon zest",shake with ice to mix and emulsify. strain into a chilled old fashioned glass filled with ice. garnish with luxardo maraschino cherries and fresh lemon zest.
red letters,".75 oz bols genever, .75 oz luxardo maraschino liqueur, .75 oz absinthe, .75 oz lime juice",,"shake with ice, strain and pour into a chilled martini glass."
almond brother,"2 oz reposado tequila, .25 oz luxardo amaretto di saschira, 1 tsp luxardo apricot liqueur, .75 oz lime juice, .25 oz luxardo orgeat syrup, .25 oz maple syrup",,"shake with ice, strain into a coupe. no garnish."
french 33,"1.5 oz no.3 london dry gin, .75 oz simple syrup, .75 oz lime juice",grapefruit twist,"shake with ice, strain into flute, top with sparkling rose and a grapefruit twist."
20th century,"1.5 oz no.3 london dry gin, .75 oz tempus fugit kina l'aero d'or, .75 oz tempus fugit creme de cacao, .75 oz fresh lemon juice",,shake with ice. strain into a chilled cocktail glass.
vesper,"2.25 oz no.3 london dry gin, .75 oz hophead vodka, .5 oz tempus fugit kina l'aero d'or",lemon peel,shake with ice. strain into chilled martini glass. garnish with lemon peel.
the seniorita,"1.5 oz the genuine curacao liqueur orange, .5 oz lime juice, 1.5 oz thai coconut milk, 2 dash angostura bitters, 1 float gosslings 151 rum","luxardo cherries, mint sprig",shake with ice. strain into rocks glass and top with crushed ice. float 1 oz. of gosslings 151 rum on top.  garnish with mint and luxardo maraschino cherries.
champs élysées,"2 oz h by hine, .75 oz lemon juice, .5 oz green chartreuse, .25 oz simple syrup, 2 dash angostura bitters",lemon wheel,shake with intent. double strain in coupe. garnish with lemon wheel.
the double crown,"1.25 oz compass box great king street glasgow blend, .75 oz lemon juice, .5 oz cyril zangs double zero eau de vie de cidre, .5 oz king's ginger liqueur, .5 oz honey syrup, 1  egg white",sage leaf,"shake without ice, add ice and shake again then fine strain into a chilled egg coupe. garnish with a sage leaf."
flip the bird,"1.5 oz pink pigeon rum, .75 oz simple syrup, .75 oz cream, .5 oz punt e mes, 1  egg yolk",cinnamon,"shake without ice, to whip and emulsify ingredients until frothy. add ice to shaker and shake vigorously. strain into port glass or small fluted glass. garnish with shaved cinnamon or nutmeg.
"
mauritius sour,".75 oz pink pigeon rum, .75 oz hirsch small batch reserve bourbon, .5 oz angostura bitters, .75 oz lemon juice, .75 oz simple syrup",luxardo cherry,"shake, and fine strain into a chilled coupe, and garnish with a luxardo cherry."
i'm only happy when it rains,"1 1/2 oz old potrero straight rye whiskey, 3/4 oz hirsh pinot noir reduction, 1/4 oz luxardo sangue morlacco cherry liqueur, 3/4 oz lemon juice ",,"shake, double strain into a burgundy glass."
monet,"1.75 oz h by hine, 1 oz benriach madeira 15 yo, .5 oz lemon juice, .25 oz briottet creme de banane, .25 oz small hand foods pineapple gum syrup",lemon twist,"shake, fine strain into a chilled coupe. garnish with lemon twist."
hippi hill,"1.5 oz hophead vodka, .75 oz king's ginger liqueur, .5 oz lime juice, .5 oz cranberry juice",lime wheel,"shake, fine strain into chilled coupe. garnish with lime wheel."
buster crusta,"2 oz h by hine, 1 oz lemon juice, .75 oz the genuine curacao liqueur orange, .5 oz luxardo maraschino liqueur, .5 oz small hand foods gum syrup, 1 bsp luxardo fernet",,"shake, fine strain into chilled frosted coupe, float fernet."
bird on,".75 oz tempus fugit creme de menthe glaciale, .75 oz tempus fugit alessio vermouth bianco, .75 oz h by hine, .375 oz lemon juice, .375 oz lime juice",lemon wedge,"shake, serve on the rocks, garnish with a lemon wedge."
iron tonic,".75 oz luxardo maraschino liqueur, .75 oz genepy, .75 oz luxardo fernet, .75 oz lime juice, 1 float tonic water",,"shake, strain into a chilled coupe, float tonic water."
king's medicine,"1.5 oz king's ginger liqueur, .75 oz lemon juice, .5 oz luxardo fernet, .25 oz benriach curiositas single malt 10 yo",lemon twist,"shake, strain into a chilled coupe. garnish with lemon twist."
where's the orgeat?,"2 oz h by hine, 1 oz small hand foods orgeat, .75 oz lemon juice, .5 oz luxardo apricot liqueur, 3 dash angostura bitters",lemon twist,"shake, strain into a chilled coupe. garnish with lemon twist."
fortune & glory,"1.5 oz chinaco reposado tequila, 1 oz lime juice, .5 oz h by hine, .5 oz small hand foods orgeat, .5 oz falernum, 2 dash mole bitters",lime wheel,"shake, strain into a chilled coupe. garnish with lime wheel."
pisco punch (adaptation by the comstock saloon),"1.5 oz barsol selecto italia pisco, .75 oz small hand foods pineapple gum syrup, .75 oz lemon juice, 3 dash kaffir tincture",lemon peel,"shake, strain into a chilled flip glass with one cube. garnish with lemon peel."
cupid's carrier pigeon,"1 oz no.3 london dry gin, 1 oz velvet falernum, .75 oz pink pigeon rum, 1 oz unfiltered apple juice, 1 oz lime juice, 3 dash angostura bitters",mint sprig,"shake, strain into a tiki glass over crushed ice and garnish with a large sprig of mint.

"
the fall 75,"1 oz junipero gin, 1 oz spiced kuri squash purée*, 2 dash fresh lemon, 2 dash honey syrup",,"shake, strain into coupe glass. top with sparkling wine and a sprig of lemon balm."
kentucky mai tai,"1 oz mezcal, 1 oz bourbon, .5 oz lemon, .5 oz peche de vigne, .5 oz cynar, .5 oz orgeat, 4 dash angostura bitters","mint sprig, cherry","shake, strain over crushed ice in a highball. garnish with a mint sprig and a cherry."
drink lab #16,"2 oz brandy, .75 oz orgeat, .75 oz luxardo sangue morlacco cherry liqueur, .5 oz lemon juice, 10 drops bittermens burlesque bitters",lemon twist,"shake, strain, lemon twist garnish."
grey anchor,"2 oz hophead vodka, .75 oz lime juice, .5 oz st. germaine elderflower liqueur, .25 oz luxardo maraschino liqueur, 5 drops bittercube door county hop bitters",lime peel twist,"shake, strain, up, garnish."
pumpkin & pecan,"2 oz h by hine, .5 oz toasted pecan syrup, .75 oz lemon juice, .5 oz cynar, 1 bsp spiced pumpkin butter, 2 dash cinnamon tincture",orange peel,shake. double strain. king cube. orange peel garnish
the red anchor,"1.75 oz junipero gin, .75 oz lemon juice, .5 oz grapefruit juice, .5 oz tempus fugit kina l'aero d'or, .25 oz ginger syrup, .25 oz simple syrup (1.5 : 1)",grapefruit slice,shake. serve in small rocks glass with no ice. grapefruit slice to garnish.
holland house,"1 oz genever, 1 oz luxardo maraschino liqueur, .5 oz dry vermouth, .5 oz lemon juice, .5 oz pineapple gomme syrup","lemon peel, pineapple",shake. serve up. garnish with lemon peel/pineapple.
last samurai,"1 oz vodka, 1 oz gin, 1 oz luxardo maraschino liqueur, .5 oz cointreau",lime wheel,shake. serve up. garnish with lime wheel.
long division,"1.5 oz tequila, 1 oz luxardo maraschino liqueur, .5 oz aperol, .25 oz lime juice",lime peel,shake. serve up. top with sparkling rose. garnish with lime peel.
sidecar,"2 oz hine rare vsop, .75 oz mathilde orange xo liqueur, .75 oz lemon juice, 1 tsp demerara syrup (2:1)",lime twist,shake. strain into a coupe. garnish with a lime twist.
spiced marmalade,"2 oz junipero gin, 1 bsp orange marmalade, .5 oz lemon juice, 1 oz orange juice, .25 oz simple syrup, 2 dash orange bitters, 4  cloves torched & muddled",lemon twist,"shake/2strain/coupe

garnish lemon twist"
mezcal witch,"2 oz mezcal, .75 oz lime, .75 oz strega, .75 oz simple syrup, 3-4  cucumbers muddled, 3-4  mint leaves, 1 pinch salt",cucumber slice,"shake/2xstrain/coupe

garnish cucumber slice"
italian margarita,"1.5 oz maestro dobel diamante tequila, .5 oz luxardo amaretto di saschira, 1 oz fresh lime juice, .25 oz monin cane syrup",,shaken and served over ice.
a bloody shame,"1.5 oz vodka, .5 oz luxardo amaretto di saschira, .75 oz blood orange vanilla mint puree*, .75 oz lime juice",lime wheel,"shaken and strained into a large coupe. garnish with a dehydrated lime wheel soaked in angostura bitters.

*blood orange vanilla mint puree:
-- 1 container boiron blood orange puree (34 oz.)
-- 39 grams mint (stems and leaves)
-- 1 tsp vanilla extract
-- 30 oz white sugar

combine all the ingredients except the mint in a pot.
bring to a light simmer, stirring to incorporate everything.
then add the mint and cook for 5 minutes, then remove the pot from the heat and strain through a chinois to remove the mint.
label and date a container, then place in your fridge. use within a week."
full of bologna,"1 oz c. drouin calvados selection, 1 oz luxardo amaro abano, .75 oz pear watercress puree, .75 oz lemon juice",mint oil,shaken and strained into a large coupe. mint oil is house-made and used as a garnish.
donaji,"2 oz mezcal, .5 oz fresh lemon juice, .5 oz fresh lime juice, .75 oz agave nectar","chapuline, salt & chile pepper rim*","shaken and strained over ice in a rocks glass.

*chapuline, salt & chile pepper rim:
grind the chapuline  (dried crickets) and dried chile pepper in a mortar and pestle, as it becomes a powder, throw in the salt and pour onto a plate. use a fresh lime wedge to moisten the rim of the glass and dip into the powder."
monkey gland,"2 oz no.3 london dry gin, 1 oz orange juice, .25 oz grenadine, 1 dash duplais swiss absinthe blanche",orange peel,shaken and strained. orange peel garnish.
you go glen coco,"1.25 oz old potrero straight rye whiskey (toasted coconut infused)*, .5 oz king's ginger liqueur, 1.25 oz turmeric coconut cream**",turmeric toasted coconut flakes,"shaken slightly. served over shaved ice in an old fashioned glass. garnished with turmeric toasted coconut flakes.

*toasted coconut infused old potrero
-- 750ml old potrero straight rye whiskey
-- 2.5 oz toasted coconut

combine all ingredients in a clean container and let sit for 8 hours.
strain through cheesecloth and then funnel back into your old potrero bottles.
keeps indefinitely.

**turmeric coconut cream:
-- 12 g fresh turmeric
-- 1 c water
-- 1 c honey
-- 3 tsp black pepper
-- 12 oz coconut milk

grate fresh turmeric into 1 cup water.
bring to a boil, add 1 cup of honey and stir.
remove from heat and let the mix sit for 1:30 hours.
strain out turmeric and add 3 tsp. ground black pepper.
add 12 oz. coconut milk and stir.
place in an airtight container and keep in the fridge. use within a week."
